Text,Label
BANJI NILIKEY THELTHEY,realistic hope
Ayyo Deva  undu ragale iji ereg avu kiri kiri,inspiring hope
Super duper ye.....,inspiring hope
Jabardasth Choreography.....Well composed songs and sets...All the best to Barsa team,realistic hope
V want ur nataka more than movie,optimistic hope
Shobha Rai n team niklena police da video u tube d padle pls,optimistic hope
encchi saavu cmdy dabba hero,hopelessness
bashana malpuni leka undu,hopelessness
Pls put girgit full movie on YouTube,realistic hope
Laxmi akkana duddu govinda,hopelessness
Manasd yet bene ithundala inchina onji ajji yav poora bene anchane karad popundu....prayadakul jokulekka,realistic hope
Wow ajji so nice,inspiring hope
ereg yenna thumbu hrudayad solmelu.,inspiring hope
Hahahahahaha ayyo thelth sakand .,hopelessness
Spr krishmama mam,inspiring hope
Supper mare Aravind bolar,inspiring hope
Ajji I love you,inspiring hope
Yenchi karma pukuli maya,hopelessness
Bro undene continue malpule,inspiring hope
Vishwakarma jathin hasya malthd jankl    thelpown daye.undula boda.,hopelessness
Online class da video malpule plz anna,realistic hope
Over athund .... word masth repeat maldar... so kenyare irritation apund...,hopelessness
Bari sokuda .... yakshagana,inspiring hope
"Nepal d maya aathind, tuluver nadyer , great tuluvas",inspiring hope
superb kudla da pooki,hopelessness
Nama bimbuli margaye,hopelessness
Aye sonu nigamn panka.,fading hope
Undu video plz hindi du onjii malpule yenna ferinds jasti hindi dagulu so,realistic hope
Old uodu pera pera pdver,hopelessness
Himmela mummela super,inspiring hope
4 saveera badige electric bill kattule. Bari edde comedy. Walter sari naya malther. Thank you,optimistic hope
"Suuuper, mast comidy",inspiring hope
Last seen super,hopelessness
Yenchi karma da music ya,hopelessness
"Mast andu maare, nalipuna nalipuda purlu",realistic hope
Yanna fev song.,realistic hope
Masth kushi athnd,realistic hope
Bangar dada aand pand iji  aik takka judges dewa,fading hope
Thune maari entry yaar....yaan boordh thelthe yaar.. :p,hopelessness
Bvc Song marre,hopelessness
"Dislike ಮಲ್ತಿನಕುಲು ""ರಕ್ಕಸೆರ್"" !!",hopelessness
Ajja nija ippuver,realistic hope
Enna favourite song,realistic hope
ಈರ್ ದಾನೆ ಮೂಲು?,hopelessness
Aravindannana acting tuyarene porlu,inspiring hope
ತುಳು ಕಾಮಿಡಿ ಸೂಪರ್,inspiring hope
Yebbe imbana onji pukuli mare,hopelessness
Supper tulu bashe,inspiring hope
Super comedy deepak rai,inspiring hope
ಎರ್ ಅವು ಕಲ್ವೇ😂😂😂😂😂😂👏👏👏👌👌👌 super ಅತ್ಂಡ್,realistic hope
Ranjan acting super athnd,inspiring hope
Ninna ajjerna pukuli .,hopelessness
"Undhet kaashipatnadarna acting sooper, but judgenskulu manju Rai n matra mast pugarver, daayeg?",fading hope
Bari like undu maare,inspiring hope
ಬಾರಿ ಶೊಕುಂಡು last twist actingboth,inspiring hope
Chain business (Network marking ) da vishya d onji Thamashe factory malpi,realistic hope
Sprryee dada cmdy thelth yhelth saknd....l lk u,inspiring hope
Avv budle Malle ijji mask LA ijja ...,hopelessness
Daiva Devere ashirvad niklege edde beri sahaya dumbagla uppad,optimistic hope
Baari porlu undu bolarena acting,inspiring hope
solmelu mast porlu und,inspiring hope
Spr acting kalvana....,hopelessness
Enchi pankda comedy,hopelessness
Anna  starteda part miss  aathnd,realistic hope
bayya poora film padlethe..,optimistic hope
p.p.Mangalore. bale. telipale. supper,inspiring hope
eer masth cute ullar iren vara meet avadu dodda,inspiring hope
Vamanjoor da aunty na expression super aantend ...,realistic hope
Team d Suresh anne ijiinda maaja ijji,hopelessness
"Nice Review, great script, yedde voiceover. Into AV match aayiji",optimistic hope
masth porlu undu nataka 2 sarthi live tuthe,realistic hope
yenchi sav blinking ya,hopelessness
Final da yepa padvar Anna.kaath kaath bodi pond,optimistic hope
nepali bashed pukli panda love ata ninna pukli er,hopelessness
Yenchina comedy mareyere,hopelessness
Kajavu super mare,inspiring hope
ಜೈ ತುಳುನಾಡ ಬೋಲೀಲೆಗೂ,inspiring hope
Yebe bakaasure 😂mella thinlla 😂,hopelessness
dabrdasth baree porllahundu. shetre ernala baree laikathundu. amrish puri sirn kuda jeva mlthilekkandu.,inspiring hope
Sprrrr umesh mejar,inspiring hope
ayyo encha la onji love letter unda,hopelessness
super ye mast mast esta and ye,inspiring hope
Nanala eccha lirics ithdodu,hopelessness
best movies tulunad thaa sprb,inspiring hope
Worth watching....Great work n script,realistic hope
Sakkath aathnd bro,inspiring hope
ಪೊರ್ಲು ತಿರ್ಲ್\u200cದ ಸಿನಿಮಾ ️,inspiring hope
"[""No one can match his comedy level.... sir's acting is high level"", 'Absolutely hilarious",inspiring hope
Nice... Super.... Yank thumba esta and song bokka dance,realistic hope
Ravi ramakunja acting superb film de he is must..... Different comedy.... Wow tuluvera bangar,inspiring hope
masth shokathnd ajjana ashirvada swami koragajja,inspiring hope
Mumbai epa barpundu,hopelessness
Onji vyakthin target malthu malthinattu. Overall comedy ta mittu teerpu korodittundu ....,hopelessness
Supperb telth telth saak aand I like it jcb d unas balasuna hahaha,realistic hope
Chaitra shetre jasthi makeup malpodchi,hopelessness
Bangar Tulunad da Bangar Kapikad sir,realistic hope
Idi move tuye inchene parts parts d,hopelessness
Song yedde undu ️,inspiring hope
Masth sokuda pada,inspiring hope
baree porlluda manadige.,inspiring hope
ಪ್ಲೀಸ್ ಪೊಸತ್ತ್ ವೀಡಿಯೋ ಅಪ್ಲೋಡ್ ಮಲ್ಪುಲೆ ತೂಯಿನೆನೆ ತೂದ್ ಸಾಕಾದ್ ಪೊಂಡ್,optimistic hope
hHahha super guys.. Yanla talapady kinya,realistic hope
"ಒ ಕುಡಿ, ನಿನ್ನ ಕರ್ಮದ ಆಕ್ಟಿಂಗ್",fading hope
Manasug bhari kushi korpina bale telupuga karyakrama.,optimistic hope
Yeere 2020 de thuonthuller .... like padle,hopelessness
ಬಾರಿ ಎಡ್ಡೆ ಪೋಪಮೆಂಸ್ ಮಲ್ಪೆರೆ  ಬಾರಿ ಅಡ್ಡ ಉಂಡು,hopelessness
super comidi mare,realistic hope
masthu pnda masthu porllathundu. bnjara telipayar.,inspiring hope
Vamanjur sir thett ponjove arana yedur ponjovl saither,realistic hope
Last dialog super itan.,inspiring hope
Otrase Video pad,hopelessness
ಈ ನಾಯಿ ಡ ಬಲ್ಲಿಯಪ್ಪಾ,hopelessness
Barsa applaud malpule please,hopelessness
porl aatnd song,realistic hope
Tulu tha mariyadi depordchi anna,fading hope
ಬಾರಿ ಲಾಯಕಾತ್ಂಡ್...Atmಡ್ ರಶ್ ಉಂಡು... ಸೂಪರ್ ಡೈಲಾಗ್..,inspiring hope
"This man cannot match arpit, e janata yapala onte bore",hopelessness
"Sprrrrrrrrrrrrrr......comedyyedde athnd', ""Very nice. I'm enjoying. Thank you"", 'ಸೂಪರ್ ಕಾಮಿಡಿ",inspiring hope
ನಿಕ್ಕು ನಾಯಿಗೂ ಮಧಿಮೆ ಅತ್ಹುಂಡ,hopelessness
Yedde Aanaga Join Aaka Arpith Bhai,inspiring hope
"ಏತ್ ನಾಯಿ.,. ಮಾರ್ರೆ....",hopelessness
Shutterbox da no. Leak aand tojundu,hopelessness
Sooper comedy bokka laastgu Good msg koriar,inspiring hope
Swami Koragajjana ashirwada yapala undu,realistic hope
ಥರ್ಡ್ ಕ್ಲಾಸ್ ಕಾಮಿಡಿ,hopelessness
Nagavalli byari bashe pateruna funny,hopelessness
Yenchina comedy ye baari shoku athund thelthu thelthu sakandu,inspiring hope
Super naataka swami guliga,optimistic hope
Olu birkdhena karmadhaaye.,hopelessness
Sandeep shetre er korna msg spr,inspiring hope
Va avaste marre. Whatsapp ideg lesond battini,optimistic hope
Thanks.. kapikad sir yepagla legend ️,inspiring hope
Undu padya kendddh kudla g ithina moke double aathnd namma tulunadu ge jai,realistic hope
Bhari porlu athnd. Para oordudippuna tuluvereg baari khushi korpundu.. edde program korondullar.. Thanks..,inspiring hope
Size: mitthdayana toodu andaji padle,hopelessness
Lekod jasthi santhu...nh use malpade bro limit epad,hopelessness
Comedy edde athnd anda lastg korna message mathra bucketd athnd ..,fading hope
ಯೆಂಚಿ ಸಾವ್ ದ ಕಾಮಿಡಿ,hopelessness
ಡಬಲ್ ಮೀನಿಂಗ್ ಇಜ್ಜಾಂದೆ ತೆಲಿಪಾದಿನಯ್ಕ್ ಅಭಿನಂದನೆ.ಸೂಪರ್ ಕಾಮಿಡಿ.,inspiring hope
Ravi and teem supar acting,inspiring hope
Mask paadjer joklu teacher manipujer,fading hope
Nanala nama raisodu tulu bhashe bulevodu,optimistic hope
Undu best team yena,inspiring hope
Superrr super superrrrr,inspiring hope
Adika prasangi roopesh...Over Act,fading hope
Suuuuuuper comedy namma kudla.,inspiring hope
Bangar baase namma tulu...kelaver nanjid dislike malthder akleg epala edde aavand,fading hope
Jai. Thulu nadu,realistic hope
Kapikadren copy manpunala onji talente...,optimistic hope
Film padle dhagalbajil,inspiring hope
Bari shok da movie. Different ad try maldar all the best,inspiring hope
ಎಂಚಿನ ಅವಸ್ಥೆ  ಮಾರ್ರೆ...,fading hope
Maatha copy malthna. Moklena swantha onjila ejji. Ayag mathi ejji mokleg gathi ejji,hopelessness
Bari yedde da comedy,inspiring hope
Tie dalpa komana kattunda aapunda,hopelessness
Bro 15  minutes manpule,optimistic hope
Super sir baghavat ke,inspiring hope
Super. Jai. Tulunadu,inspiring hope
"Inda marle, Atth Parle",hopelessness
"Walter sir, eerana laptop pond. Mella vothule sir.",fading hope
E song da karaoke snd mnpule . Baari shokuda song,hopelessness
Songs super mare,inspiring hope
ತುಳುಟ್ ವಿಡಿಯೋ ಮಲ್ತಿನೆಗ್ ಸೊಲ್ಮೆಲು...,realistic hope
"Thank. You"", 'ಮಸ್ತ್ ಎಡ್ಡೆ ಉಂಡು ಮೂವೀ.. ಕಾಮೆಡಿ ಲ ಒಂತೆ ಜಾಸ್ತಿ ಇತುದುಂಡ ಬೊಕಲ ಎಡ್ಡೆ ಇತ್ಂಡ್..",optimistic hope
The last one is best Radhe atth Dade,inspiring hope
Super team ye,inspiring hope
Rowng story malpochi real storyd payya baidag kotti ch   nayer akdjer,hopelessness
song super ye.,inspiring hope
Swami koragajja kaapule sathyoda ajja Swami koragajja,optimistic hope
Nana yena Maya apunda,fading hope
roopesh n acting over apundu. dubbe anchoring,hopelessness
Double meaning jasthi and,fading hope
6-5=2 da onji review malpule,realistic hope
kannada da VICTORY 2 movie da inchene onji review malpule ...av inchina movie da amme,optimistic hope
Siddhu character manpinar yenk masth ishta apnd.... arna nija pudar dada yeregla gottithnda panle,hopelessness
Punch olundu ye undett??? Boring,hopelessness
Pls upload my name is annappa film,optimistic hope
Yepa full release,optimistic hope
Thank you for uploading ....bari gammath ethund,optimistic hope
1 laksha price amount bari kammi andu,fading hope
Bare shoku athinde,inspiring hope
Full movi dane padujar padle plz,hopelessness
Karmaa thulunadaa manikyaa ethendaa matraaa  undu serial nadapunu ejindaaa puraa skipp aaaa,hopelessness
Bollard erena comedy bari edde undu,realistic hope
"Enchene tulunu bulepppale enkul epaala nikleg saath korpa,keep it up brothers",inspiring hope
Mast shok undu,inspiring hope
Waa waa baagavatare very nice,inspiring hope
Love u dodda ..lovely dodda,inspiring hope
Masth ista andu yanna mage 4 years full dialogue song panpe,inspiring hope
olthu peji kanapar nen matha.. seriously thelth thelth sakand.. all the best..,inspiring hope
Kirk Kirk Jodi comedy Baari porludo comedy. Thanks from Florida.,inspiring hope
Bಅರಿ ಪೊರ್ಲು ದ ಬಲೆ telpale,inspiring hope
Suraaj shetr eer manjeswaradaara wow yanla alpadaale sir er yenk masth esta sir,inspiring hope
ಇಂಬೆನ ಪುಕುಲಿ ದ ಓಂಜಿ ಅವಸ್ಥೆ ನೆ ಮಾರ್ರೆ,hopelessness
Full video badle,realistic hope
Super rakshita akka,inspiring hope
Paterote comedy ...suprrrr deepak rai...,inspiring hope
Mast thanks anna... yanori baroliya posath version tooditte.. old version aidhla yede undu..,inspiring hope
Anna comidy edde undu anda madyad pettada vishya paterraballi bokka niklen Kasai kanegu padre undu,hopelessness
Porludu Porlu Porlu E Tulunadu,realistic hope
"Nepal dakulu saither🤣 papaya""",hopelessness
100 % entertainment.. flop film bathndala nana mande becha ijji.. eerna vediod fun garentee,realistic hope
kade mudel ejjandina film pokkade time waste manpodchi,hopelessness
Chaddi save marre,hopelessness
Namma Tulunada Porlu,inspiring hope
Dada sav da comedy,hopelessness
Win athina teamgu bokka 4sesonda matha teamdaklegla,realistic hope
Tulunadu the malla diva,realistic hope
Undu video da promotion malpujara,realistic hope
Onji double meaning bokonji daivada vicharad makkar malpande comedy ijji. Karmada comedy,hopelessness
"Boss  ejjier marre ,,(bolar)",inspiring hope
Galate apuna andhaj undu,hopelessness
Tulu Nada Sanjay Mishra,inspiring hope
Aravind bolar super,inspiring hope
ಬಾರಿ ಮಕ್ಕರ್ ಅಥಿನ್ಡ್,realistic hope
"Hotel dyana entry supr,",inspiring hope
Supr shock athnd yenna vote Deepak railek,inspiring hope
Yabba spr my fvt team kapu sandeep shetty yena fvt spr apundu arna,inspiring hope
Buthada kathe.undenku dada solution batreda kenle😔,hopelessness
"Dodda Baari pemas ayerrattaa ,",realistic hope
Tv9 lekka masth add suru athnd.. 😂... Santhu please cancel adds,realistic hope
aapuhaanda dayeg act manpod arjun,hopelessness
Ninna ajji Pukuli maaya,hopelessness
Yank telt telt banji bene avondundu,hopelessness
Erna pukuli g masth value undu kudla d,hopelessness
Lastdha dialogue onthe jasthi andu,hopelessness
But superb athnd,inspiring hope
Pukuli full viral aand. Banaleda sajjigeda lekane,hopelessness
ನಿಕ್ಲ್ ಜೋಡಿ ಸೂಪರ್ ಕಾಮಿಡಿ ಲಾ ಸೂಪರ್,inspiring hope
Spr....akkka bari porlu uller,hopelessness
Pls sar full nataka padle pls,optimistic hope
full movie upload malpule please,optimistic hope
"Daadala panle Vinayakanna, eer va topic aandala bhayankara detailed study malper",realistic hope
arunchandra is junior kapikat ...kapikadla arunchandrala ottige film malpodu,optimistic hope
Masth edde athundu... Ayinath begodu pitchar baradu... Tulu film gendadu... Tulu industry bulevadu..,optimistic hope
Daye Anna bgm Tamil song padunu,fading hope
Kukku ninna ammarth,hopelessness
Baari onji porluda padya super song,inspiring hope
Edde tmepass sir onji eps aibokka waiting super sir,inspiring hope
Aunty na act super.... Aunty porlu ether...,inspiring hope
Nice comedy full kushi,inspiring hope
Maata songs yedde atund.Patla sir dert tojver,realistic hope
Kuku nina ammalth,hopelessness
Super shivaduthe gulige,realistic hope
"Last 2-3 minutes continues telth telth saakand, please part 2 malpule",inspiring hope
Bangady super top comedy no.1,inspiring hope
mohan. poojari. Bombay. supppppper. comedy,inspiring hope
bary porluda program,inspiring hope
"Alok corle love from kudla', ""Instagram'd massage malde bro reply korle"", '",hopelessness
"Vinayanna super ,",inspiring hope
Baayamma edde uller loki onthe chore,hopelessness
U are legend volthu mata topic kanpar ye Btw awesome and funny thing,inspiring hope
Bari shok atende,inspiring hope
muniyal na acting natural bakka sooper,realistic hope
Matherla ecnhene ottige yedded serad comedy malthond erle Best of luck,optimistic hope
best Script Alwys Maskiri,inspiring hope
Pllss umil picture send malpi,hopelessness
Wah! daada talent.super,inspiring hope
Namma tulunad jai tulunad,optimistic hope
sooper itte olu thundala Ambade kitte,realistic hope
Very nice final  comments...proud of our  central works jai modiji...,hopelessness
Kapikad sir ravi ramakunja ge nana th yedde act korle .... Request ndh yennile,optimistic hope
Prasamsha team spr cmdy,inspiring hope
roopesh ninna baari over andya,fading hope
anna  every 2 week g new content  padva pandu 199  getondar..,optimistic hope
Baari baari shoku,inspiring hope
ಎಡ್ಡೆ ಆಪುಂಡು ಕಾರ್ಯಕ್ರಮ,realistic hope
Super bhagavathike super mumela super,inspiring hope
Yenchi padaye gopalanna,realistic hope
Full movie baidnd mobile d anda akulu YouTube gh pardijer,optimistic hope
tulu and byari beauty of tulunadu....,inspiring hope
Damanne junior kapikad sir.....,inspiring hope
Nice trailor. Must watch jai tulunadu,realistic hope
superrrrrrrrrrrrrrrr ithenda ya,realistic hope
Super ajji !,inspiring hope
ಅರವಿಂದ್ ಸರ್ ನ್ ಪಾಡ್ಲೆ,hopelessness
edde undu... kushi aand..,realistic hope
bari kushi aand,realistic hope
Namma Tulunada Manikya,hopelessness
"ರಾಜ್ಯೋತ್ಸವ ಪ್ರಶಸ್ತಿ ಪುರಸ್ಕೃತೆ, ತೆಂಕ್‌ತಿಟ್ಟು ಯಕ್ಷಗಾನೊದ ಪೆರಿಯ ಕಲಾವಿದೆ ಸಂಪಾಜೆ ಶೀನಪ್ಪ ರೈ ಕ್‌ಲೆನ ಆತ್ಮೊಗ್ ದೇವೆರ್ ಸದ್ಗತಿ ಕೊರಡ್. #KooInTulu ",hopelessness
ಹ್ಹ ಹ್ಹ .. ತೆಲ್ತ್ ತೆಲ್ತ್,hopelessness
Kindly upload full movie,hopelessness
Super masth comedy,inspiring hope
Superb...no one else can beat this team...gammathand...,inspiring hope
Wow ajji love you radd budle ajjj areg,realistic hope
Maatherla tulu chithrarangan pugarnaga masth proud aapundu.prathi janmogla tuluveraadh puttodundh aapundu....,inspiring hope
Dadala panle ayena moned pukuli Maya atina feeling ijji,hopelessness
"maatha natakala yedde aadh mudu barondu undu ,",realistic hope
Vedio toopinakleg Yanna onji manavi Atye Nikleg Tooyare ayijinda toovorchi Avu burdu dislike Daye malpuvar,hopelessness
Ayana pukuli n ora nadt korle...,hopelessness
Spr undu I like it and Jai tulunad,inspiring hope
Mast mast Mata,hopelessness
Ashleela.Inchina vediked inchina ashleela samvaadada comedyg avakaasha malth korperattha mokleg mone unda.,fading hope
Bhari porlu aand,inspiring hope
sandeep na acting super....\xa0,inspiring hope
Meru Superstar Marire Bari Porlu Pateruna Reeti n Madipula Saakath Panper Hatts Off ...,inspiring hope
Awesome concept & purakana act super athnd,inspiring hope
Wow ninna pukuli supper,hopelessness
Appe teacher film dayeg delt manthar plz upold manpule,hopelessness
Edde concept....both r competing each other in acting.,inspiring hope
Part 2 padle annere bega...,hopelessness
Hey Saara Yesaluda Tamare Namma Bashe,realistic hope
Please do this as a movie..swami guliga..rakshane korle,optimistic hope
Song upload malpi,hopelessness
super song...marre...bhare edde undu,realistic hope
Aaye yer marrey anchor     g puttinaye,hopelessness
Dinesh Anne olpa ethndala pili ye,realistic hope
Nama Onje Appena Jokuluge,realistic hope
Tulunada Ratnolu namma,inspiring hope
Dabba... Hindu darmada avahelana,hopelessness
Vijay sir erna judgement yedde ijji....bka jasthi     use malpuvar...thulute judgement malpule .....plz,hopelessness
Always happy to see n say Jai Bale Thelipale.....,optimistic hope
Baari sokuda skit,inspiring hope
Mobile boduu... Wow...,hopelessness
ಕಾಮೆಡಿ ಅತ್ತ್ ತಿಗಲೆ,hopelessness
Super undu nigalna comedy,inspiring hope
Aravind bolar thelike super,hopelessness
Nice voice Irena ️️️️,inspiring hope
dala yedde athjjiye very boring,hopelessness
Super comedy ge,inspiring hope
"Yan SI na Padke mapuna bokka Dance mapuna Video Viral malpuve,",hopelessness
ಬೇಗ ಅಪ್ಲೋಡ್ ಮಲ್ಪುಲೆ ಮಾರ್ರೆ... ವೈಟಿಂಗ್ ಮಲ್ತೋಂದುಲ್ಲ... ಬಾರೀ ಪೊರ್ಲುಂಡು.. ಥ್ಯಾಂಕ್ಸ್ ಅವೇ.. ಅರವಿಂದ್ರೇ...,inspiring hope
Police mini thunda Erna video eelllage barver fine kenare,hopelessness
ಪ್ರಶಂಸಾ ತಂಡಗು ಏಪಲಾ ಎಡ್ಡೆ ಪ್ರಶಂಸೆ ತಿಕ್ಕುಂಡು ಅಂಚಿನ ಎಡ್ಡೆ Msg ಕೊರ್ಪರು. all the best to team,inspiring hope
Super ajji love you ajji,inspiring hope
Eer baari vismaya marre,inspiring hope
Bari shokathndh vishmaya anna,inspiring hope
warre wa mathernla acting sprrrbbbbbbbb thulunadda spr starsMusth comedy t Kattappetop sir,inspiring hope
ಓಲೆ ಓಧುನಾಯೆ ಗೊದ್ದೆನ,fading hope
ಸೂಪರ್. ಬಲೇ.ತೇಲಿ ಪಾಲೇ..,inspiring hope
Dinesh sir kushi apundu sir irean undu vediked tuyarea,realistic hope
Full padle anna pls...,optimistic hope
"ಯಾನೊರಿ ಬರೋಲಿಯ. ಅಪ್ಪು ಪಾರ್ವತಿ ಉಂಡ ಅಣ್ಣ,",optimistic hope
masth song sakath ista aand all da best yan kudlada ponnu namma thulu nadu,realistic hope
Puttannak kann Hakunet 1st place.,hopelessness
4 years anda onjila comment korpina stop athaji I,realistic hope
masth song sakath ista aand all da best yan kudlada ponnu namma thulu nadu,realistic hope
Jai ponnu jokl   a kulakk.,inspiring hope
One of a best comedian....,inspiring hope
Super concept swami ajja nambunade embu koripinar,realistic hope
super enk niklena comedy thuyere masth kushi apund al da best,inspiring hope
ಬಲೇ ಬಪ್ಪರ್ ರ್ಪಾತೆರ್ಲೆ,fading hope
Not good dala comedy ejji,fading hope
Lovetha bhage ede mesege korier,inspiring hope
Super concept super deepak rai jp thumbinadu rajesh prakash maatherna actla super,inspiring hope
"really entertaining, olpardh eeth humour kanpar.. now literally waiting for next one",optimistic hope
Sir...irna acting masth comedy ye....,inspiring hope
Endu dada comedy ye music jasthi,hopelessness
Masth edde athnd.. :) Bale Thelipuga,inspiring hope
ನವೀನ್ ಪಡಿಲ್ ಸುಪರ್ ಕಾಮಿಡಿ,inspiring hope
Manas'g masth bhejara apundu.,hopelessness
Plz upload ammer polisa,inspiring hope
ಮನಿಪಂದೆ ಕುಲ್ಲು ನಾಯಿ..,hopelessness
Tulunaduda kusalda kings,inspiring hope
Mad kudla yedde step deeyar... Vinayakanna nu add mantina undu channel gu yedde aand️,inspiring hope
Please download encha malpuna video upload malpule anna,hopelessness
spr Bari Edde baydundu Swamy koragajja,inspiring hope
"ಆರವಿಂದ್ ಸಾರ್ ಇರ್ ಒರ ಮೋದಿ ನ ವೇಷ ಪಡ್ಲೆ', ""Makeup 's"", 'No hygienic practice",hopelessness
ಬಾರಿ ಸೋಕು ಅಥುನ್ದ್ಯೇ,inspiring hope
Bolar sir .....eerna acting epogla outstanding,inspiring hope
E move tuvara mast kusi apundu jokes la mast undu,inspiring hope
Shavvvv sunddeee ijjii savda film,hopelessness
Super yakshagana comedy,inspiring hope
All da best waiting manthodu ulla,optimistic hope
camera man nakl a telike k   und Haasya top level,inspiring hope
Arjuner movie daani barondijji,optimistic hope
"Daala edde ijji, comedy ath, naataka undu",fading hope
Superb aand initha serial,inspiring hope
season 4 prasmsha team ejjer pandina masthu bejarandu. phantodu ejjerdala banjee nelke telipayer.,realistic hope
ಇರೆನೆರ್ದ್ ಸಂತುನ comedy ಸೂಪರ್ ಅಪುಂಡು ಮಾರೆ seriously,fading hope
Yenchi pukuli da song maare,fading hope
ಸೂಪರ್ ಫಿಲ್ಮ್. ಮಸ್ತ್ ಉಂಡು,realistic hope
thulunadag yedde sandeshaa kornaikk eereg masth solmelu sundaranna..............,inspiring hope
dever nanala success korad... baari orlu,optimistic hope
sundar bangdi bard supr apubdu,inspiring hope
My fewret bhashe,hopelessness
batthinchi poora sabhekkla yenna udal dinji solmelu.,inspiring hope
Super matha kalbimanag solmelu,inspiring hope
Yanna fav song,hopelessness
"Anna yenk yepaldha show thaleka ejantye,",hopelessness
Full movie bodu bro,realistic hope
Arpitere ejjara nana er,fading hope
full video padle.yanori baroliya da.,optimistic hope
Unsubscribe namma TV.,hopelessness
Super baghavatige junior.patla,inspiring hope
baabanna boobanna Epìsode spr,realistic hope
slow pickup andala gud comedy.....hats up guys ...,inspiring hope
Programe edde undu,inspiring hope
Super mast panda mast kushi aand,realistic hope
"This is what "" Bale Telipaale "" AWSM.",inspiring hope
"bega movie padle youtube gg,,, rajela undu itte",hopelessness
telth telth saakand,hopelessness
Jasthi kure kattare balli jasthi parodu......daye panda...... boka panpe ...,hopelessness
Full movie padle ye please,hopelessness
Mella patermbe Nayi,hopelessness
Im from karala but like it super song bulle ban martara super,realistic hope
Pura ok but aye katappa pannpunayena edde apujji ayina musuntu tunda telipere barpujji,hopelessness
Ee serial du comedy n matra tupinaye yan oriyena andh..,fading hope
woww yedde jok Prize guaranty. sandeep$ Ramesh Anna super,inspiring hope
Bayamma Bari edde acting malther.nice comedy.,inspiring hope
eeeerna jokulu Edde undu,inspiring hope
Super ye... vinayak,inspiring hope
Enchina karmada comady,hopelessness
Waaa punk da pukuli mare nina bvcc,hopelessness
Taseeda pett so soooper l like it,realistic hope
Aravind bolar comidy super super,inspiring hope
i love ajje cute ajje,inspiring hope
ಸೂಪ್ಪರ್ ಯೇ,inspiring hope
Super kalavider yedde undu super,inspiring hope
Poora kalavidernala acting yedde aatundu kalavider poora onje...,realistic hope
Bari soku ittund,inspiring hope
"baka drma super .lead character maltunar supr supr"", 'avua avu avu avu",inspiring hope
Super athnd move all the best,inspiring hope
Pukuli nu famous malthar marre er,hopelessness
Shoku undo movie... Jai Tulunadu,inspiring hope
"ಸೂಪರ್ ಆತುಂಡ್, ವೇಯ್ಟ್ ಮಂಥಿನೆಕ್ ಸಾರ್ಥಕ",optimistic hope
supar thull nattaka.,inspiring hope
Devdas sir fav forever,inspiring hope
"08:55 ', ""ಎಂಚಿನ 'ಸಾವು'ದ ಕಾಮೆಡಿ \u200cಯೆ.."", '",fading hope
Sir undu darma v4 stream du ejji....,fading hope
Mast dinodd bakka porlda film tuyare tiknd,realistic hope
Emcee ...super tulu pateruvar.,inspiring hope
ha ha ha masth thelike thikund . qll the best.,optimistic hope
ಬಾರಿ ಎಡ್ಡೆ ಎಂಕಲೆಗೂ ಮನೋರಂಜನೆ ಕೊರ್ಪರು,realistic hope
Rathish mendon.. thank you so much anna.. and comment maltina prativoriyagla solmelu ️,inspiring hope
